{
  "schema_version": "sourceright.journal_screening.v1",
  "submission_id": "BENCH-001",
  "platform": "ojs",
  "status": "screened",
  "editorial_summary": "Submission BENCH-001 (benchmark.txt) screened with status Screened: 1 references, 0 issues, 0 AI-risk citation-error signals.",
  "author_action_checklist": [
    "No citation-integrity actions were generated by this screening run."
  ],
  "reference_report": {
    "schema_version": "sourceright.reference_report.v1",
    "report_type": "reference_integrity",
    "summary": {
      "total_references": 1,
      "verified_references": 1,
      "review_queue_count": 0,
      "unresolved_count": 0,
      "conflict_count": 0,
      "ai_risk_issue_count": 0,
      "error_count": 0,
      "warning_count": 0,
      "info_count": 0
    },
    "issues": []
  }
}
